idn_empreendimento;idn_digs;dsc_titulo;val_2011_2014;val_pos_2014;investimento_total;sig_uf;txt_municipios;txt_executores;dsc_orgao;idn_estagio;dat_ciclo;dat_selecao;dat_conclusao_revisada;val_lat;val_long;emblematica;observacao
1346;2000;Inventário - Bacia do Rio Aripuanã - AM MT;2232000.00;;;AM MT;APUÍ/AM, NOVO ARIPUANÃ/AM, ARIPUANÃ/MT, COLNIZA/MT, RONDOLÂNDIA/MT;Empresa de Pesquisa Energética;Ministério de Minas e Energia;90;31/10/2014;;30/05/2011;"10°9'43.920000""S";"59°27'28.080000""O";;Previsão para 31/12/2014 - 
1354;2000;Inventário - Bacia do Rio Trombetas - AM PA RR;5926000.00;7266000.00;;AM PA RR;NHAMUNDÁ/AM, CAROEBE/RR, ALENQUER/PA, ÓBIDOS/PA, ORIXIMINÁ/PA;Empresa de Pesquisa Energética;Ministério de Minas e Energia;71;31/10/2014;;;;;;Previsão para 31/12/2014 - 
1357;2001;LT 230 kV Balsas - Ribeiro Gonçalves - MA PI;70000000.00;;;MA PI;RIBEIRO GONÇALVES/PI, BALSAS/MA;Eletrobras Eletronorte;Ministério de Minas e Energia;90;31/10/2014;;03/12/2011;"7°32'43.800000""S";"45°38'20.400000""O";;Previsão para 31/12/2014 - 
1368;2000;Usina Hidrelétrica - Batalha - GO MG;333600000.00;;;GO MG;PARACATU/MG, CRISTALINA/GO, CAMPO ALEGRE DE GOIÁS/GO;FURNAS;Ministério de Minas e Energia;90;31/10/2014;;17/05/2014;"17°20'44.160000""S";"47°28'22.800000""O";;Previsão para 31/12/2014 - 
1381;2000;Usina Hidrelétrica - Cachoeira - MA PI;;;;MA PI;BARÃO DE GRAJAÚ/MA, SÃO JOÃO DOS PATOS/MA, FLORIANO/PI, GUADALUPE/PI, JERUMENHA/PI;CNEC Engenharia S.A., Companhia hidro elétrica do São Francisco, Construtora Queiroz Galvão S/A;Ministério de Minas e Energia;10;31/10/2014;;;"6°45'12.744000""S";"43°3'41.040000""O";;Previsão para 31/12/2014 - Valor não divulgado em razão da possibilidade de uso do Regime Diferenciado de Contratação - RDC.
1427;2000;Usina Hidrelétrica - Castelhano - MA PI;;;;MA PI;PARNARAMA/MA, SÃO FRANCISCO DO MARANHÃO/MA, AMARANTE/PI, PALMEIRAIS/PI;CNEC Engenharia S.A., Companhia hidro elétrica do São Francisco, Construtora Queiroz Galvão S/A;Ministério de Minas e Energia;10;31/10/2014;;;"5°44'20.004000""S";"43°5'29.040000""O";;Previsão para 31/12/2014 - Valor não divulgado em razão da possibilidade de uso do Regime Diferenciado de Contratação - RDC.
1480;2001;LT 230 kV Curitiba - Joinville Norte - PR SC;28330000.00;;;PR SC;CURITIBA/PR, JOINVILLE/SC;Interligação Elétrica Sul S.A.;Ministério de Minas e Energia;70;31/10/2014;;;"25°51'57.600000""S";"49°3'34.200000""O";;Previsão para 31/12/2014 - 
1509;2000;Usina Hidrelétrica - Estreito - MA TO;1617000000.00;;;MA TO;AGUIARNÓPOLIS/TO, PALMEIRAS DO TOCANTINS/TO, ESTREITO/MA;Consórcio Estreito Energia;Ministério de Minas e Energia;90;31/10/2014;;30/04/2011;"6°35'18.309984""S";"47°27'50.640012""O";EMBLEMATICA;Previsão para 31/12/2014 - 
1510;2000;Usina Hidrelétrica - Estreito Parnaíba - MA PI;;;;MA PI;GRAJAÚ/MA, SÃO FRANCISCO DO MARANHÃO/MA, AMARANTE/PI, FLORIANO/PI;CNEC Engenharia S.A., Companhia hidro elétrica do São Francisco, Construtora Queiroz Galvão S/A;Ministério de Minas e Energia;10;31/10/2014;;;"6°19'31.872000""S";"42°51'10.440000""O";;Previsão para 31/12/2014 - Valor não divulgado em razão da possibilidade de uso do Regime Diferenciado de Contratação - RDC.
1578;2001;Interligação Madeira - Porto Velho - Araraquara (circuito 1) - LOTES C e D - GO MG MT RO SP;3660000000.00;;;GO MG MT RO SP;PORTO VELHO/RO, CANDEIAS DO JAMARI/RO, ALTO PARAÍSO/RO, ARIQUEMES/RO, CACAULÂNDIA/RO, JARU/RO, OURO PRETO DO OESTE/RO, TEIXEIRÓPOLIS/RO, JI-PARANÁ/RO, PRESIDENTE MÉDICI/RO, CASTANHEIRAS/RO, ROLIM DE MOURA/RO, PIMENTA BUENO/RO, SÃO FELIPE D'OESTE/RO, PRIMAVERA DE RONDÔNIA/RO, PARECIS/RO, CHUPINGUAIA/RO, CORUMBIARA/RO, COLORADO DO OESTE/RO, CABIXI/RO, COMODORO/MT, NOVA LACERDA/MT, VILA BELA DA SANTÍSSIMA TRINDADE/MT, PONTES E LACERDA/MT, JAURU/MT, INDIAVAÍ/MT, ARAPUTANGA/MT, RESERVA DO CABAÇAL/MT, RIO BRANCO/MT, SALTO DO CÉU/MT, LAMBARI D'OESTE/MT, BARRA DO BUGRES/MT, ALTO PARAGUAI/MT, ROSÁRIO OESTE/MT, JANGADA/MT, ACORIZAL/MT, CUIABÁ/MT, SANTO ANTÔNIO DO LEVERGER/MT, CAMPO VERDE/MT, JACIARA/MT, JUSCIMEIRA/MT, RONDONÓPOLIS/MT, SÃO JOSÉ DO POVO/MT, GUIRATINGA/MT, PEDRA PRETA/MT, ALTO GARÇAS/MT, ALTO ARAGUAIA/MT, SANTA RITA DO ARAGUAIA/GO, MINEIROS/GO, SERRANÓPOLIS/GO, JATAÍ/GO, CAÇU/GO, SANTA VITÓRIA/MG, LIMEIRA DO OESTE/MG, ITURAMA/MG, OUROESTE/SP, GUARANI D'OESTE/SP, MACEDÔNIA/SP, PEDRANÓPOLIS/SP, FERNANDÓPOLIS/SP, MERIDIANO/SP, VALENTIM GENTIL/SP, VOTUPORANGA/SP, SEBASTIANÓPOLIS DO SUL/SP, MONTE APRAZÍVEL/SP, POLONI/SP, NEVES PAULISTA/SP, JACI/SP, NOVA ALIANÇA/SP, POTIRENDABA/SP, IBIRÁ/SP, URUPÊS/SP, MARAPOAMA/SP, ITAJOBI/SP, ITÁPOLIS/SP, TABATINGA/SP, NOVA EUROPA/SP, GAVIÃO PEIXOTO/SP, ARARAQUARA/SP, UNIÃO DE MINAS/MG, VALE DE SÃO DOMINGOS/MT;Estação Transmissora de Energia, Interligação Elétrica do Madeira S.A.;Ministério de Minas e Energia;90;31/10/2014;;01/08/2013;;;EMBLEMATICA;Previsão para 31/12/2014 - 
1581;2001;Interligação Tucuruí - Macapá - Manaus (Jurupari-Oriximiná e Jurupari-Macapá) - LOTE B - AP PA;859440000.00;;;AP PA;ORIXIMINÁ/PA, AMAPÁ/AP;Linhas de Macapá Transmissora de Energia;Ministério de Minas e Energia;90;31/10/2014;;21/01/2014;;;EMBLEMATICA;Previsão para 31/12/2014 - 
1589;2000;Aproveitamentos Hidrelétricos - Itapiranga - RS SC;;;;RS SC;ITAPIRANGA/SC, MONDAÍ/SC, SÃO JOÃO DO OESTE/SC, CAIÇARA/RS, PINHEIRINHO DO VALE/RS, VICENTE DUTRA/RS, VISTA ALEGRE/RS;Desenvix S/A;Ministério de Minas e Energia;10;31/10/2014;;;"27°11'27.600000""S";"53°39'33.840000""O";;Previsão para 31/12/2014 - Valor não divulgado em razão da possibilidade de uso do Regime Diferenciado de Contratação - RDC.
1600;2001;LT 230 kV Jardim - Penedo - AL SE;23310000.00;;;AL SE;NOSSA SENHORA DO SOCORRO/SE, PENEDO/AL;Companhia hidro elétrica do São Francisco;Ministério de Minas e Energia;90;31/10/2014;;28/03/2014;;;;Previsão para 31/12/2014 - 
1681;2002;Plangas GLP - ES RJ;1801670000.00;71270000.00;;ES RJ;;Petrobras;Ministério de Minas e Energia;90;31/10/2014;;30/05/2014;;;;Previsão para 31/12/2014 - 
1776;2000;Usina Hidrelétrica - Riacho Seco - BA PE;;;;BA PE;LAGOA GRANDE/PE, SANTA MARIA DA BOA VISTA/PE, CURAÇÁ/BA, JUAZEIRO/BA;Companhia hidro elétrica do São Francisco, Desenvix S/A, ODEBRECHT;Ministério de Minas e Energia;10;31/10/2014;;;"8°47'2.004000""S";"39°40'51.960000""O";;Previsão para 31/12/2014 - Valor não divulgado em razão da possibilidade de uso do Regime Diferenciado de Contratação - RDC.
1777;2000;Usina Hidrelétrica - Ribeiro Gonçalves - MA PI;;;;MA PI;SAMBAÍBA/MA, TASSO FRAGOSO/MA, RIBEIRO GONÇALVES/PI, SANTA FILOMENA/PI;CNEC Engenharia S.A., Companhia hidro elétrica do São Francisco, Queiroz Galvão;Ministério de Minas e Energia;10;31/10/2014;;;"7°34'21.000000""S";"45°17'24.000000""O";;Previsão para 31/12/2014 - Valor não divulgado em razão da possibilidade de uso do Regime Diferenciado de Contratação - RDC.
1826;2000;Aproveitamentos Hidrelétricos - Serra Quebrada - MA TO;;;;MA TO;AGUIARNÓPOLIS/TO, ITAGUATINS/TO, MAURILÂNDIA DO TOCANTINS/TO, TOCANTINÓPOLIS/TO, CAMPESTRE DO MARANHÃO/MA, ESTREITO/MA, GODOFREDO VIANA/MA, GOVERNADOR EDISON LOBÃO/MA, IMPERATRIZ/MA, MONTES ALTOS/MA, PORTO FRANCO/MA, RIBAMAR FIQUENE/MA;Construções e Comércio Camargo Corrêa S/A, Eletrobras Eletronorte;Ministério de Minas e Energia;10;31/10/2014;;;"5°40'40.296000""S";"47°29'34.440000""O";;Previsão para 31/12/2014 - Valor não divulgado em razão da possibilidade de uso do Regime Diferenciado de Contratação - RDC.
1828;2000;Usina Hidrelétrica - Simplício - MG RJ;275730000.00;2000000.00;;MG RJ;ALÉM PARAÍBA/MG, CHIADOR/MG, SAPUCAIA/RJ, TRÊS RIOS/RJ;FURNAS;Ministério de Minas e Energia;91;31/10/2014;;;"22°2'2.389992""S";"43°0'3.390012""O";EMBLEMATICA;Previsão para 31/12/2014 - 
1845;1001;Ferrovia Nova Transnordestina - CE PE PI;2614740000.00;2721510000.00;;CE PE PI;CAMPINAS DO PIAUÍ/PI, CANTO DO BURITI/PI, CARIDADE DO PIAUÍ/PI, CONCEIÇÃO DO CANINDÉ/PI, ELISEU MARTINS/PI, ISAÍAS COELHO/PI, MASSAPÊ DO PIAUÍ/PI, PAES LANDIM/PI, PAJEÚ DO PIAUÍ/PI, PATOS DO PIAUÍ/PI, PAVUSSU/PI, RIBEIRA DO PIAUÍ/PI, SIMÕES/PI, SIMPLÍCIO MENDES/PI, SOCORRO DO PIAUÍ/PI, ACARAPÉ/CE, ACOPIARA/CE, AURORA/CE, BATURITÉ/CE, BREJO SANTO/CE, CAPISTRANO/CE, CEDRO/CE, FORTALEZA/CE, GUAIÚBA/CE, ICÓ/CE, IGUATU/CE, JARDIM/CE, LAVRAS DA MANGABEIRA/CE, MARACANAÚ/CE, MISSÃO VELHA/CE, PACATUBA/CE, PENAFORTE/CE, PIQUET CARNEIRO/CE, PORTEIRAS/CE, QUIXADÁ/CE, QUIXERAMOBIM/CE, REDENÇÃO/CE, SENADOR POMPEU/CE, AFOGADOS DA INGAZEIRA/PE, ARAÇOIABA/PE, ARARIPINA/PE, ARCOVERDE/PE, BELO JARDIM/PE, BEZERROS/PE, BODOCÓ/PE, CALUMBI/PE, CARNAÍBA/PE, CARUARU/PE, CUSTÓDIA/PE, FLORES/PE, GRANITO/PE, GRAVATÁ/PE, IGUARACI/PE, IPUBI/PE, JABOATÃO DOS GUARARAPES/PE, MIRANDIBA/PE, MORENO/PE, OURICURI/PE, PARNAMIRIM/PE, PESQUEIRA/PE, POMBOS/PE, RECIFE/PE, SAIRÉ/PE, SALGUEIRO/PE, SANHARÓ/PE, SANTA CRUZ DA BAIXA VERDE/PE, SÃO CAITANO/PE, SÃO JOSÉ DO BELMONTE/PE, SERRA TALHADA/PE, SERRITA/PE, SERTÂNIA/PE, TACAIMBÓ/PE, TRINDADE/PE, TRIUNFO/PE, VITÓRIA DE SANTO ANTÃO/PE;Concessionária TL S/A;Ministério dos Transportes;70;31/10/2014;;;;;EMBLEMATICA;
2246;2001;LT 230 kV Picos - Tauá - CE PI;71027000.00;;;CE PI;TAUÁ/CE, PICOS/PI;Companhia hidro elétrica do São Francisco;Ministério de Minas e Energia;90;31/10/2014;;01/02/2013;"6°32'24.000000""S";"40°52'48.000000""O";;Previsão para 31/12/2014 - 
2509;2005;Sistema de Logística de Etanol - GO-MG-SP;2356380000.00;3779100000.00;;GO MG SP;UBERABA/MG, ANHEMBI/SP, ARAÇATUBA/SP, PAULÍNIA/SP, PRESIDENTE EPITÁCIO/SP, RIBEIRÃO PRETO/SP, SÃO JOSÉ DOS CAMPOS/SP, APARECIDA DO RIO DOCE/GO, ITUMBIARA/GO, SENADOR CANEDO/GO;Petrobras;Ministério de Minas e Energia;91;31/10/2014;;;;;EMBLEMATICA;Previsão para 31/12/2014 - 
4180;1000;BR-319/RO - Construção de Ponte sobre o Rio Madeira/RO - AM RO;355960000.00;;;AM RO;HUMAITÁ/AM, PORTO VELHO/RO;DNIT, Exército;Ministério dos Transportes;90;31/10/2014;;15/09/2014;;;;
4244;6002;Projeto de Integração do Rio São Francisco com as Bacias do Nordeste Setentrional - Eixo Leste - PB PE;968890000.00;175000000.00;;PB PE;ALCANTIL/PB, AMPARO/PB, AROEIRAS/PB, BARRA DE SANTANA/PB, BARRA DE SÃO MIGUEL/PB, BAYEUX/PB, BOA VISTA/PB, BOQUEIRÃO/PB, CABACEIRAS/PB, CALDAS BRANDÃO/PB, CAMALAÚ/PB, CAMPINA GRANDE/PB, CARAÚBAS/PB, CATURITÉ/PB, CONGO/PB, COXIXOLA/PB, CRUZ DO ESPÍRITO SANTO/PB, CUBATI/PB, FAGUNDES/PB, FREI MARTINHO/PB, GADO BRAVO/PB, GURINHÉM/PB, GURJÃO/PB, INGÁ/PB, ITABAIANA/PB, ITATUBA/PB, JOÃO PESSOA/PB, JUAREZ TÁVORA/PB, JUAZEIRINHO/PB, JURIPIRANGA/PB, LIVRAMENTO/PB, MARI/PB, MASSARANDUBA/PB, MOGEIRO/PB, MONTEIRO/PB, NATUBA/PB, NOVA PALMEIRA/PB, OLIVEDOS/PB, OURO VELHO/PB, PARARI/PB, PEDRA LAVRADA/PB, PICUÍ/PB, PILAR/PB, POCINHOS/PB, PRATA/PB, PUXINANÃ/PB, QUEIMADAS/PB, RIACHÃO DO BACAMARTE/PB, RIACHÃO DO POÇO/PB, RIACHO DE SANTO ANTÔNIO/PB, SALGADO DE SÃO FÉLIX/PB, SANTA CECÍLIA/PB, SANTA RITA/PB, SANTO ANDRÉ/PB, SÃO DOMINGOS DO CARIRI/PB, SÃO JOÃO DO CARIRI/PB, SÃO JOÃO DO TIGRE/PB, SÃO JOSÉ DOS RAMOS/PB, SÃO JOSÉ DOS CORDEIROS/PB, SÃO MIGUEL DE TAIPU/PB, SÃO SEBASTIÃO DO UMBUZEIRO/PB, SAPÉ/PB, SERIDÓ/PB, SERRA BRANCA/PB, SERRA REDONDA/PB, SOBRADO/PB, SOLEDADE/PB, SUMÉ/PB, TAPEROÁ/PB, TENÓRIO/PB, UMBUZEIRO/PB, ZABELÊ/PB, AFOGADOS DA INGAZEIRA/PE, AGRESTINA/PE, ÁGUAS BELAS/PE, ALAGOINHA/PE, ALTINHO/PE, ANGELIM/PE, ARCOVERDE/PE, BARRA DE GUABIRABA/PE, BELO JARDIM/PE, BETÂNIA/PE, BEZERROS/PE, BOM CONSELHO/PE, BOM JARDIM/PE, BONITO/PE, BREJÃO/PE, BREJINHO/PE, BREJO DA MADRE DE DEUS/PE, BUÍQUE/PE, CACHOEIRINHA/PE, CAETÉS/PE, CALÇADO/PE, CALUMBI/PE, CAMOCIM DE SÃO FÉLIX/PE, CANHOTINHO/PE, CAPOEIRAS/PE, CARNAÍBA/PE, CARUARU/PE, CASINHAS/PE, CORRENTES/PE, CUMARU/PE, CUPIRA/PE, CUSTÓDIA/PE, FEIRA NOVA/PE, FLORES/PE, FLORESTA/PE, FREI MIGUELINHO/PE, GARANHUNS/PE, GRAVATÁ/PE, IATI/PE, IBIMIRIM/PE, IBIRAJUBA/PE, IGUARACI/PE, INAJÁ/PE, INGAZEIRA/PE, ITAÍBA/PE, ITAPETIM/PE, JATAÚBA/PE, JOÃO ALFREDO/PE, JUCATI/PE, JUPI/PE, JUREMA/PE, LAGOA DO OURO/PE, LAGOA DOS GATOS/PE, LAJEDO/PE, LIMOEIRO/PE, MACHADOS/PE, MANARI/PE, OROBÓ/PE, PALMEIRINA/PE, PANELAS/PE, PARANATAMA/PE, PASSIRA/PE, PEDRA/PE, PESQUEIRA/PE, POÇÃO/PE, QUIXABA/PE, RIACHO DAS ALMAS/PE, SAIRÉ/PE, SALGADINHO/PE, SALOÁ/PE, SANHARÓ/PE, SANTA CRUZ DA BAIXA VERDE/PE, SANTA CRUZ DO CAPIBARIBE/PE, SANTA MARIA DO CAMBUCÁ/PE, SANTA TEREZINHA/PE, SÃO BENTO DO UNA/PE, SÃO CAITANO/PE, SÃO JOÃO/PE, SÃO JOAQUIM DO MONTE/PE, SÃO JOSÉ DO EGITO/PE, SÃO VICENTE FERRER/PE, SERRA TALHADA/PE, SERTÂNIA/PE, SOLIDÃO/PE, SURUBIM/PE, TABIRA/PE, TACAIMBÓ/PE, TAQUARITINGA DO NORTE/PE, TEREZINHA/PE, TORITAMA/PE, TRIUNFO/PE, TUPANATINGA/PE, TUPARETAMA/PE, VENTUROSA/PE, VERTENTE DO LÉRIO/PE, VERTENTES/PE;Ministério da Integração Nacional;Ministério da Integração Nacional;70;31/10/2014;;;;;EMBLEMATICA;Previsão para 31/12/2014 - 
4245;6002;Projeto de Integração do Rio São Francisco com as Bacias do Nordeste Setentrional - Eixo Norte - Trechos I e II - CE PB PE RN;3064910000.00;515720000.00;;CE PB PE RN;ABAIARA/CE, ALTO SANTO/CE, AQUIRAZ/CE, ARACATI/CE, AURORA/CE, BAIXIO/CE, BARBALHA/CE, BARRO/CE, BEBERIBE/CE, BREJO SANTO/CE, CARIRIAÇU/CE, CASCAVEL/CE, CAUCAIA/CE, CEDRO/CE, CHOROZINHO/CE, CRATO/CE, EUSÉBIO/CE, FORTALEZA/CE, FORTIM/CE, GRANJEIRO/CE, GUAIÚBA/CE, HORIZONTE/CE, ICAPUÍ/CE, ICÓ/CE, IPAUMIRIM/CE, ITAIÇABA/CE, ITAITINGA/CE, JAGUARETAMA/CE, JAGUARIBARA/CE, JAGUARIBE/CE, JAGUARUANA/CE, JARDIM/CE, JATI/CE, JUAZEIRO DO NORTE/CE, LAVRAS DA MANGABEIRA/CE, LIMOEIRO DO NORTE/CE, MARACANAÚ/CE, MARANGUAPE/CE, MAURITI/CE, MILAGRES/CE, MISSÃO VELHA/CE, MORADA NOVA/CE, OCARA/CE, PACAJUS/CE, PACATUBA/CE, PALHANO/CE, PENAFORTE/CE, PINDORETAMA/CE, PORTEIRAS/CE, QUIXERÉ/CE, RUSSAS/CE, SÃO GONÇALO DO AMARANTE/CE, SÃO JOÃO DO JAGUARIBE/CE, TABULEIRO DO NORTE/CE, UMARI/CE, VÁRZEA ALEGRE/CE, SÃO JOÃO DO RIO DO PEIXE/PB, APARECIDA/PB, AREIA DE BARAÚNAS/PB, ASSUNÇÃO/PB, BELÉM DO BREJO DO CRUZ/PB, BERNARDINO BATISTA/PB, BOM JESUS/PB, BOM SUCESSO/PB, BONITO DE SANTA FÉ/PB, BREJO DO CRUZ/PB, BREJO DOS SANTOS/PB, CACHOEIRA DOS ÍNDIOS/PB, CACIMBA DE AREIA/PB, CAJAZEIRAS/PB, CARRAPATEIRA/PB, CATOLÉ DO ROCHA/PB, CONDADO/PB, VISTA SERRANA/PB, JERICÓ/PB, JUNCO DO SERIDÓ/PB, LAGOA/PB, LASTRO/PB, MALTA/PB, MARIZÓPOLIS/PB, MATO GROSSO/PB, MONTE HOREBE/PB, NAZAREZINHO/PB, PASSAGEM/PB, PATOS/PB, PAULISTA/PB, POÇO DANTAS/PB, POÇO DE JOSÉ DE MOURA/PB, POMBAL/PB, QUIXABÁ/PB, RIACHO DOS CAVALOS/PB, SALGADINHO/PB, SANTA CRUZ/PB, SANTA HELENA/PB, SANTA LUZIA/PB, JOCA CLAUDINO/PB, SÃO BENTO/PB, SÃO BENTINHO/PB, SÃO DOMINGOS/PB, SÃO FRANCISCO/PB, SÃO JOSÉ DA LAGOA TAPADA/PB, SÃO JOSÉ DE ESPINHARAS/PB, SÃO JOSÉ DE PIRANHAS/PB, SÃO JOSÉ DO BREJO DO CRUZ/PB, SÃO JOSÉ DO SABUGI/PB, SÃO MAMEDE/PB, SOUSA/PB, TRIUNFO/PB, UIRAÚNA/PB, VÁRZEA/PB, VIEIRÓPOLIS/PB, ARARIPINA/PE, BODOCÓ/PE, CABROBÓ/PE, CARNAUBEIRA DA PENHA/PE, CEDRO/PE, EXU/PE, GRANITO/PE, IPUBI/PE, MIRANDIBA/PE, OURICURI/PE, PARNAMIRIM/PE, SALGUEIRO/PE, SÃO JOSÉ DO BELMONTE/PE, SERRITA/PE, MOREILÂNDIA/PE, TERRA NOVA/PE, TRINDADE/PE, VERDEJANTE/PE;Ministério da Integração Nacional;Ministério da Integração Nacional;70;31/10/2014;;;;;EMBLEMATICA;Previsão para 31/12/2014 - 
4536;6002;Implantação, Ampliação ou Melhoria de Sistemas Públicos de Esgotamento Sanitário em Municípios das Bacias do São Francisco e Parnaíba - AL BA MA MG PE PI SE;1103152880.00;;;AL BA MA MG PE PI SE;IBIMIRIM/PE, GRANITO/PE, FLORESTA/PE, EXU/PE, CEDRO/PE, BUÍQUE/PE, PAINS/MG, PETROLÂNDIA/PE, AMPARO DE SÃO FRANCISCO/SE, MONTE ALEGRE DE SERGIPE/SE, NOSSA SENHORA DA GLÓRIA/SE, MALHADA DOS BOIS/SE, JAPOATÃ/SE, ITABI/SE, ILHA DAS FLORES/SE, GRACHO CARDOSO/SE, GARARU/SE, CEDRO DE SÃO JOÃO/SE, CANINDÉ DE SÃO FRANCISCO/SE, CANHOBA/SE, BOM DESPACHO/MG, CARNEIROS/AL, AQUIDABÃ/SE, CRAÍBAS/AL, TRAIPU/AL, SÃO BRÁS/AL, SANTANA DO IPANEMA/AL, PIAÇABUÇU/AL, OLHO D'ÁGUA DO CASADO/AL, OLHO D'ÁGUA DAS FLORES/AL, MAJOR ISIDORO/AL, JARAMATAIA/AL, JACARÉ DOS HOMENS/AL, IGREJA NOVA/AL, BODOCÓ/PE, BREJO GRANDE/SE, CARINHANHA/BA, BENEDITO LEITE/MA, BARÃO DE GRAJAÚ/MA, ARAIOSES/MA, ALTO PARNAÍBA/MA, PACATUBA/SE, SÃO FRANCISCO/SE, TELHA/SE, ABARÉ/BA, BARRA/BA, BOTUPORÃ/BA, CAMPO FORMOSO/BA, CABROBÓ/PE, CANARANA/BA, COELHO NETO/MA, CATURAMA/BA, CENTRAL/BA, GENTIO DO OURO/BA, GLÓRIA/BA, IBOTIRAMA/BA, IGAPORÃ/BA, IPUPIARA/BA, ITAGUAÇU DA BAHIA/BA, IUIÚ/BA, JACARACI/BA, JEREMOABO/BA, CANÁPOLIS/BA, ILHA GRANDE/PI, ARARIPINA/PE, AFOGADOS DA INGAZEIRA/PE, URUÇUÍ/PI, UNIÃO/PI, SANTA FILOMENA/PI, RIBEIRO GONÇALVES/PI, PORTO ALEGRE DO PIAUÍ/PI, PORTO/PI, MURICI DOS PORTELAS/PI, BUENÓPOLIS/MG, FRANCISCO SÁ/MG, CAETÉ/MG, CAPITÃO ENÉAS/MG, CAPITÓLIO/MG, CATUTI/MG, DORESÓPOLIS/MG, MADEIRO/PI, ENGENHEIRO NAVARRO/MG, ESPINOSA/MG, JOCA MARQUES/PI, FRANCISCO DUMONT/MG, MACURURÉ/BA, BRASILÂNDIA DE MINAS/MG, SÃO FÉLIX DO CORIBE/BA, MUQUÉM DE SÃO FRANCISCO/BA, OUROLÂNDIA/BA, PALMAS DE MONTE ALTO/BA, PARAMIRIM/BA, PARATINGA/BA, PILÃO ARCADO/BA, BREJO/MA, REMANSO/BA, RIO DO PIRES/BA, RODELAS/BA, GUADALUPE/PI, FLORIANO/PI, AMARANTE/PI, BURITIZEIRO/MG, TASSO FRAGOSO/MA, SÃO FRANCISCO DO MARANHÃO/MA, SANTA QUITÉRIA DO MARANHÃO/MA, PARNARAMA/MA, XIQUE-XIQUE/BA, SANTA MARIA DA VITÓRIA/BA, NOVA IORQUE/MA, MIRANGABA/BA, MALHADA/BA, MILAGRES DO MARANHÃO/MA, MAGALHÃES DE ALMEIDA/MA, DUQUE BACELAR/MA, BELÉM DE SÃO FRANCISCO/PE, LUZILÂNDIA/PI, ABAETÉ/MG, SERRA DO RAMALHO/BA, SENTO SÉ/BA, SÍTIO DO MATO/BA, TANQUE NOVO/BA, UMBURANAS/BA, ARCOS/MG, PAPAGAIOS/MG, BAMBUÍ/MG, VÁRZEA NOVA/BA, ITABIRITO/MG, MORPARÁ/BA, MORRO DO CHAPÉU/BA, PEDRAS DE MARIA DA CRUZ/MG, SANTA BRÍGIDA/BA, URUANA DE MINAS/MG, PONTO CHIQUE/MG, PRESIDENTE JUSCELINO/MG, PRUDENTE DE MORAIS/MG, QUARTEL GERAL/MG, RIACHO DOS MACHADOS/MG, RIO ACIMA/MG, VERDELÂNDIA/MG, VARZELÂNDIA/MG, ICARAÍ DE MINAS/MG, VARGEM BONITA/MG, PEQUI/MG, UBAÍ/MG, TRÊS MARIAS/MG, TIROS/MG, TAQUARAÇU DE MINAS/MG, SÃO ROQUE DE MINAS/MG, SÃO JOÃO DO PACUÍ/MG, SÃO JOÃO DA PONTE/MG, SÃO GONÇALO DO ABAETÉ/MG, SANTANA DE PIRAPAMA/MG, VÁRZEA DA PALMA/MG, LUZ/MG, IBIAÍ/MG, IGUATAMA/MG, SANTA FÉ DE MINAS/MG, ITACARAMBI/MG, JAÍBA/MG, JAPARAÍBA/MG, JEQUITAÍ/MG, JUVENÍLIA/MG, LAGOA DA PRATA/MG, POMPÉU/MG, LONTRA/MG, PIUMHI/MG, MANGA/MG, MATIAS CARDOSO/MG, MEDEIROS/MG, MIRABELA/MG, MORADA NOVA DE MINAS/MG, PAINEIRAS/MG, CALUMBI/PE, LUÍS EDUARDO MAGALHÃES/BA, GUARDA-MOR/MG, LAGOA DOS PATOS/MG, OURICURI/PE, CANAPI/AL, CACIMBINHAS/AL, BATALHA/AL, BELO MONTE/AL, TRINDADE/PE, TABIRA/PE, MOREILÂNDIA/PE, SERTÂNIA/PE, BOCAIÚVA/MG, SANTA TEREZINHA/PE, SANTA MARIA DA BOA VISTA/PE, LAPÃO/BA, PARNAMIRIM/PE, DELMIRO GOUVEIA/AL, MIRANDIBA/PE, ITACURUBA/PE, IPUBI/PE, IGUARACI/PE;Codevasf;Ministério da Integração Nacional;71;31/10/2014;31/12/2014;;;;EMBLEMATICA;Previsão para 31/12/2014 - 
4537;6002;Recuperação e Controle de Processos Erosivos - AL BA CE MA MG PE PI SE TO;218202144.84;;;AL BA CE MA MG PE PI SE TO;SERRANÓPOLIS DE MINAS/MG, CARACOL/PI, PEDRO LAURENTINO/PI, GRANITO/PE, SÃO MIGUEL DO TAPUIO/PI, SÃO JOÃO DO PIAUÍ/PI, SÃO JOÃO DA VARJOTA/PI, SANTA FILOMENA/PI, SANTA CRUZ DO PIAUÍ/PI, QUEIMADA NOVA/PI, ILHA GRANDE/PI, NOVA SANTA RITA/PI, JACOBINA DO PIAUÍ/PI, PAULISTANA/PI, PATOS DO PIAUÍ/PI, PARNAÍBA/PI, OEIRAS/PI, MARCOLÂNDIA/PI, JOCA MARQUES/PI, JERUMENHA/PI, SIMÕES/PI, PICOS/PI, MAJOR ISIDORO/AL, PIAÇABUÇU/AL, PENEDO/AL, PARICONHA/AL, PÃO DE AÇÚCAR/AL, PALESTINA/AL, OURO BRANCO/AL, OLHO D'ÁGUA DO CASADO/AL, CANAPI/AL, MATA GRANDE/AL, SANTANA DO IPANEMA/AL, IGREJA NOVA/AL, IGACI/AL, GIRAU DO PONCIANO/AL, DOIS RIACHOS/AL, DELMIRO GOUVEIA/AL, CRAÍBAS/AL, FLORES/PE, OLHO D'ÁGUA DAS FLORES/AL, CAPELA/SE, POÇO REDONDO/SE, NOSSA SENHORA DA GLÓRIA/SE, NEÓPOLIS/SE, MONTE ALEGRE DE SERGIPE/SE, JAPOATÃ/SE, JAPARATUBA/SE, ILHA DAS FLORES/SE, PIRANHAS/AL, GARARU/SE, PORTO REAL DO COLÉGIO/AL, CANINDÉ DE SÃO FRANCISCO/SE, BREJO GRANDE/SE, AMPARO DE SÃO FRANCISCO/SE, TRAIPU/AL, SENADOR RUI PALMEIRA/AL, SÃO SEBASTIÃO/AL, SÃO JOSÉ DA TAPERA/AL, CACIMBINHAS/AL, GRACHO CARDOSO/SE, JATOBÁ/PE, PETROLINA/PE, PETROLÂNDIA/PE, PESQUEIRA/PE, PEDRA/PE, PARNAMIRIM/PE, PARANATAMA/PE, OURICURI/PE, CARNEIROS/AL, LAGOA GRANDE/PE, SANTA CRUZ/PE, ITAÍBA/PE, ITACURUBA/PE, IPUBI/PE, INAJÁ/PE, IBIMIRIM/PE, IATI/PE, PORTO DA FOLHA/SE, OROCÓ/PE, TERRA NOVA/PE, BELO MONTE/AL, BATALHA/AL, ARAPIRACA/AL, ÁGUA BRANCA/AL, VERDEJANTE/PE, VENTUROSA/PE, TUPANATINGA/PE, QUIXABA/PE, TRINDADE/PE, SALGUEIRO/PE, MOREILÂNDIA/PE, SERTÂNIA/PE, SERRITA/PE, SERRA TALHADA/PE, SÃO JOSÉ DO BELMONTE/PE, SANTA MARIA DA BOA VISTA/PE, SANTA FILOMENA/PE, FLORESTA/PE, TRIUNFO/PE, SÃO ROQUE DE MINAS/MG, BOM CONSELHO/PE, VIÇOSA DO CEARÁ/CE, AFOGADOS DA INGAZEIRA/PE, AFRÂNIO/PE, ÁGUAS BELAS/PE, ARARIPINA/PE, ARCOVERDE/PE, BELÉM DE SÃO FRANCISCO/PE, SÃO RAIMUNDO NONATO/PI, BODOCÓ/PE, SÃO BENEDITO/CE, BUÍQUE/PE, CABROBÓ/PE, CAETÉS/PE, CALUMBI/PE, CEDRO/PE, DORMENTES/PE, EXU/PE, BETÂNIA/PE, IPAPORANGA/CE, SOCORRO DO PIAUÍ/PI, ARARENDÁ/CE, CARNAUBAL/CE, CRATEÚS/CE, CROATÁ/CE, GRANJA/CE, GUARACIABA DO NORTE/CE, UBAJARA/CE, INDEPENDÊNCIA/CE, TAMBORIL/CE, IPU/CE, IPUEIRAS/CE, NOVA RUSSAS/CE, NOVO ORIENTE/CE, PORANGA/CE, QUITERIANÓPOLIS/CE, MARAVILHA/AL, IBIAPINA/CE, JABOTICATUBAS/MG, TANQUE NOVO/BA, INHAPI/AL, GAMELEIRAS/MG, GLAUCILÂNDIA/MG, GUARACIAMA/MG, IBIRACATU/MG, IBIRITÉ/MG, IGUATAMA/MG, PROPRIÁ/SE, ITAÚNA/MG, ENGENHEIRO NAVARRO/MG, JAÍBA/MG, JANAÚBA/MG, JEQUITAÍ/MG, JOÃO PINHEIRO/MG, JURAMENTO/MG, LAGAMAR/MG, LAGOA DOS PATOS/MG, LAGOA FORMOSA/MG, ITABIRITO/MG, CAETÉ/MG, UAUÁ/BA, UIBAÍ/BA, WANDERLEY/BA, XIQUE-XIQUE/BA, BOCAIÚVA/MG, BRASILÂNDIA DE MINAS/MG, BRASÍLIA DE MINAS/MG, BRUMADINHO/MG, FRANCISCO DUMONT/MG, CABECEIRA GRANDE/MG, LEANDRO FERREIRA/MG, CAPIM BRANCO/MG, CAPITÃO ENÉAS/MG, CARMÓPOLIS DE MINAS/MG, CATUTI/MG, CHAPADA GAÚCHA/MG, CURVELO/MG, DIVINÓPOLIS/MG, DOM BOSCO/MG, BURITIZEIRO/MG, SÃO JOÃO DA LAGOA/MG, LAGOA GRANDE/MG, PRESIDENTE OLEGÁRIO/MG, RAPOSOS/MG, RIACHO DOS MACHADOS/MG, RIO ACIMA/MG, SABARÁ/MG, SANTA FÉ DE MINAS/MG, SANTANA DO RIACHO/MG, SANTO ANTÔNIO DO MONTE/MG, PEDRA DO INDAIÁ/MG, SÃO GONÇALO DO PARÁ/MG, PATIS/MG, SÃO JOÃO DA PONTE/MG, SÃO JOÃO DAS MISSÕES/MG, SARZEDO/MG, SETE LAGOAS/MG, TRÊS MARIAS/MG, UNAÍ/MG, VARZELÂNDIA/MG, VAZANTE/MG, SÃO FRANCISCO/MG, NATALÂNDIA/MG, ESPINOSA/MG, MAMONAS/MG, MÁRIO CAMPOS/MG, MATIAS CARDOSO/MG, MATO VERDE/MG, MIRABELA/MG, MONJOLOS/MG, MONTE AZUL/MG, PORTEIRINHA/MG, MORADA NOVA DE MINAS/MG, LASSANCE/MG, NOVA LIMA/MG, NOVA PORTEIRINHA/MG, ONÇA DE PITANGUI/MG, PAI PEDRO/MG, PARACATU/MG, PARÁ DE MINAS/MG, PARAOPEBA/MG, PASSA TEMPO/MG, MONTES CLAROS/MG, JABORANDI/BA, CORRENTINA/BA, COTEGIPE/BA, CRISTÓPOLIS/BA, CURAÇÁ/BA, FORMOSA DO RIO PRETO/BA, GLÓRIA/BA, GUANAMBI/BA, IRECÊ/BA, MUQUÉM DE SÃO FRANCISCO/BA, IUIÚ/BA, FRANCISCO SÁ/MG, JEREMOABO/BA, JUAZEIRO/BA, LUÍS EDUARDO MAGALHÃES/BA, MACURURÉ/BA, MALHADA/BA, MANSIDÃO/BA, MATINA/BA, MORRO DO CHAPÉU/BA, ITAGUAÇU DA BAHIA/BA, CAMPO ALEGRE DE LOURDES/BA, ABARÉ/BA, ANGICAL/BA, BAIANÓPOLIS/BA, BARRA/BA, BARREIRAS/BA, BOM JESUS DA LAPA/BA, BONINAL/BA, BROTAS DE MACAÚBAS/BA, TABOCAS DO BREJO VELHO/BA, CAFARNAUM/BA, COCOS/BA, CAMPO FORMOSO/BA, CANÁPOLIS/BA, CANDIBA/BA, CANUDOS/BA, CARINHANHA/BA, CASA NOVA/BA, CATOLÂNDIA/BA, CORIBE/BA, CAETITÉ/BA, RODELAS/BA, CHORROCHÓ/BA, PALMAS DE MONTE ALTO/BA, SOBRADINHO/BA, SÍTIO DO MATO/BA, SERRA DOURADA/BA, SENTO SÉ/BA, SERRA DO RAMALHO/BA, SÃO DESIDÉRIO/BA, SÃO FÉLIX DO CORIBE/BA, SANTANA/BA, SANTA MARIA DA VITÓRIA/BA, SOUTO SOARES/BA, SANTA RITA DE CÁSSIA/BA, SEABRA/BA, RIO DE CONTAS/BA, RIACHO DE SANTANA/BA, RIACHÃO DAS NEVES/BA, REMANSO/BA, PINDAÍ/BA, PILÃO ARCADO/BA, PIATÃ/BA, PAULO AFONSO/BA, PARATINGA/BA, PARAMIRIM/BA, SANTA BRÍGIDA/BA, GUARIBAS/PI, GILBUÉS/PI, FLORESTA DO PIAUÍ/PI, FARTURA DO PIAUÍ/PI, DOM INOCÊNCIO/PI, CURRAL NOVO DO PIAUÍ/PI, CASTELO DO PIAUÍ/PI, SIMPLÍCIO MENDES/PI, BREJO DO PIAUÍ/PI, JAICÓS/PI, ANÍSIO DE ABREU/PI, ALVORADA DO GURGUÉIA/PI, TIMON/MA, BALSAS/MA, ALTO PARNAÍBA/MA, ASSUNÇÃO DO PIAUÍ/PI, VERDELÂNDIA/MG;Governo do Estado da Bahia, Governo do Estado de Alagoas, Governo do Estado de Minas Gerais, Governo do Estado do Piauí, Governo Federal, ONG;Ministério da Integração Nacional;71;31/10/2014;31/12/2014;;;;EMBLEMATICA;Previsão para 31/12/2014 - 
4573;2001;LT 230 kV Pau Ferro - Santa Rita II - PB PE;;;;PB PE;SANTA RITA/PB, IGARASSU/PE;Companhia hidro elétrica do São Francisco;Ministério de Minas e Energia;40;31/10/2014;;;;;;Previsão para 31/12/2014 - Valor não divulgado em razão da possibilidade de uso do Regime Diferenciado de Contratação - RDC.
4908;1001;Trem de Alta Velocidade Rio/Sao Paulo/Campinas - RJ SP;;;;RJ SP;BARRA MANSA/RJ, RIO DE JANEIRO/RJ, VOLTA REDONDA/RJ, CAMPINAS/SP, GUARULHOS/SP, SÃO JOSÉ DOS CAMPOS/SP, SÃO PAULO/SP;Concessionária;Ministério dos Transportes;41;31/10/2014;;;;;EMBLEMATICA;Valor não divulgado em razão da possibilidade de uso do Regime Diferenciado de Contratação - RDC.
4910;1001;Prolongamento da Ferrovia Norte-Sul - Conexão com a Ferrovia do Pantanal (Estudo) - MS SP;24140000.00;;;MS SP;ESTRELA D'OESTE/SP, DOURADOS/MS, PORTO MURTINHO/MS, PANORAMA/SP;VALEC;Ministério dos Transportes;90;31/10/2014;;25/05/2012;;;;
4911;1001;Projeto de Extensão da Ferrovia de Integração Centro Oeste - Lucas do Rio Verde/MT - Vilhena/RO - GO MT RO;;;;GO MT RO;VILHENA/RO, CAMPINORTE/GO, NOVA IGUAÇU DE GOIÁS/GO, PILAR DE GOIÁS/GO, SANTA TEREZINHA DE GOIÁS/GO, CRIXÁS/GO, NOVA CRIXÁS/GO, ARUANÃ/GO, COCALINHO/MT, NOVA NAZARÉ/MT, ÁGUA BOA/MT, GAÚCHA DO NORTE/MT, NOVA UBIRATÃ/MT, SORRISO/MT, LUCAS DO RIO VERDE/MT, NOVA MUTUM/MT, NOVA MARINGÁ/MT, BRASNORTE/MT, SAPEZAL/MT, CAMPOS DE JÚLIO/MT, COMODORO/MT;VALEC;Ministério dos Transportes;90;31/10/2014;;31/05/2014;;;;
